[
  {
    "id": "sec-01-komodo-mbeliling",
    "order": 1,
    "title": "Komodo gate and the Mbeliling forest",
    "subtitle": "Leaving the tourist town for the first farm tracks",
    "from_node": "n-labuan-bajo",
    "to_node": "n-werang",
    "theme": [
      "forest",
      "highland",
      "coast"
    ],
    "story": "Labuan Bajo starts the race as the gateway everyone already knows: Komodo dragons, dive boats and an international airport. The course turns its back on the harbour almost immediately and climbs into the Mbeliling forest reserve, roughly 15,000 hectares of Important Bird Area and the highest ground in West Manggarai at about 1,275 m -- habitat for the Flores hanging parrot, Flores monarch, Flores crow and Flores owl, none of them found anywhere else on Earth. Two waterfalls, Cunca Wulang and Cunca Rami, sit on or near the corridor as the first honest test of design rule 1: prefer the small farm track over the paved road, even when the road is scenic.\n\nThe section ends at Sano Nggoang, an elliptical caldera lake reported to be among the deepest volcanic lakes on Earth, with solfataras and hot springs steaming quietly on its south-east shore. Werang, the kecamatan capital just beyond it, is the first real resupply stop after the lake -- a parish church, a police post, a handful of kiosks. Neither the lake nor the forest track has been scouted yet; several node coordinates in this section (Denge, Dintor, Cunca Rami) are still flagged unverified in the desk data, which is exactly why this section opens the first scouting season rather than closing it.",
    "highlight_pois": [
      "p-komodo-np-gateway",
      "p-mbeliling-forest",
      "p-cunca-wulang",
      "p-cunca-rami",
      "p-sano-nggoang",
      "p-wai-sano-volcano"
    ],
    "target_km": [
      90,
      130
    ],
    "hab_expected": "low",
    "scouting_priority": 2,
    "open_questions": [
      "Is the Mbeliling forest track rideable end-to-end, or does it require dismounts near Cunca Wulang/Cunca Rami?",
      "Cunca Rami's desk position and DEM elevation disagree by roughly 400 m; needs a field GPS fix.",
      "Homestay capacity at Sano Nggoang for race-week volume is unconfirmed."
    ],
    "public": true
  },
  {
    "id": "sec-02-wae-rebo-south-coast",
    "order": 2,
    "title": "Wae Rebo and the south coast of Manggarai",
    "subtitle": "The flagship cultural checkpoint, on foot with the bike",
    "from_node": "n-werang",
    "to_node": "n-iteng",
    "theme": [
      "culture",
      "coast",
      "highland"
    ],
    "story": "The course drops off the Sano Nggoang plateau to the quiet south coast at Dintor and Denge, then leaves the road entirely: the Wae Rebo trail is roughly 8-9 km and +700 m, walked with the bike on the same porters' path that carries every sack of rice and roof repair up to the village. Wae Rebo's seven cone-shaped mbaru niang houses, arranged in a circle around a ceremonial ground, won UNESCO's 2012 Asia-Pacific Award for Cultural Heritage Conservation; it is Flores' most photographed place and the clearest test of the whole project's promise that villages are hosts, not scenery. A fixed homestay and guest-fee system already exists for tourists, but a race-specific agreement with the village council is required before any checkpoint is confirmed -- nothing here happens without it.\n\nBeyond Wae Rebo the concept line continues over the ridge to Todo, the former seat of the Manggarai kingdom and home to the oldest standing mbaru niang in the regency; if the onward trail proves impassable with a loaded bike, variant B falls back to an out-and-back through Denge and a road link to Todo instead. Either way the section closes at Iteng, the practical resupply before the climb to Ruteng. This is a cultural-checkpoint section in the fullest sense: design rule 5 (villages are hosts, not scenery) and the route concept's own open questions both point here first.",
    "highlight_pois": [
      "p-wae-rebo",
      "p-todo-village",
      "p-satar-mese-coast"
    ],
    "target_km": [
      100,
      140
    ],
    "hab_expected": "high",
    "scouting_priority": 1,
    "open_questions": [
      "Which villages will host cultural checkpoints, under what terms? (Wae Rebo and Todo council agreements not yet negotiated)",
      "Is the Wae Rebo onward trail passable with a bike, or is it an out-and-back?",
      "Dintor and Denge's coordinates are unverified desk placements; both need a field GPS fix."
    ],
    "public": true
  },
  {
    "id": "sec-03-manggarai-highlands",
    "order": 3,
    "title": "Manggarai highlands",
    "subtitle": "The roof of the west, and the deepest history on the island",
    "from_node": "n-iteng",
    "to_node": "n-liang-bua",
    "theme": [
      "highland",
      "history"
    ],
    "story": "From Iteng the course climbs roughly 1,100 m to Ruteng, the coolest, most orderly town of the whole west region and its best full resupply: market, hospital, banks, many hotels, all in the shadow of the island's highest ground. Poco Mandasawu (2,370 m, the roof of Flores) and Poco Ranaka (2,350 m, with the 1987 lava dome Anak Ranakah) form the massif the road has to skirt on its way to Ranamese, a small crater lake at 1,220 m with a warung at the car park -- the highest, coldest rest stop on the whole course.\n\nThe descent north trades altitude for deep time: Liang Bua, the limestone cave where a joint Indonesian-Australian team excavated *Homo floresiensis* in 2003, still used by the local Manggarai community for ceremonies. It is the one checkpoint that turns the whole traverse into an argument about how old this island's story really is, long before Wae Rebo, before the Manggarai kingdom, before anyone now living. Cancar's spider-web rice fields sit a short, no-hike-a-bike side trip west of Ruteng if the schedule allows -- one of the few highlights on the whole course that costs nothing in effort to reach.",
    "highlight_pois": [
      "p-cancar-lingko",
      "p-poco-mandasawu",
      "p-poco-ranaka",
      "p-ranamese-lake",
      "p-liang-bua",
      "p-ruteng-cathedral",
      "p-ruteng-market",
      "p-golo-curu",
      "p-cunca-rede"
    ],
    "target_km": [
      90,
      130
    ],
    "hab_expected": "medium",
    "scouting_priority": 3,
    "open_questions": [
      "Is there a farm-track alternative to the paved road over the Ranamese/Poco Ranaka pass, per design rule 1?",
      "Does a more direct farm track exist between Ranamese and Liang Bua than the current desk sketch, which doubles back near Ruteng?"
    ],
    "public": true
  },
  {
    "id": "sec-04-north-coast",
    "order": 4,
    "title": "The forgotten north coast",
    "subtitle": "Where the water and the track both run out",
    "from_node": "n-liang-bua",
    "to_node": "n-riung",
    "theme": [
      "coast",
      "savanna"
    ],
    "story": "Liang Bua descends to Reo, an old north-coast port town with a market, a bank and a homestay -- the last reliable resupply before the section that most likely defines the whole race. From Reo the course follows dry, lontar-palm savanna toward Pota and Riung: small ports, few visitors, and, as far as the desk research can tell, no documented continuous track and no confirmed water source along the way. This is the section the route concept names explicitly as the water constraint of the whole course.\n\nRiung is the reward at the far end: a fishing port and gateway to the Seventeen Islands Marine Park, more than twenty coral islets reached by hired boat, with flying foxes on Pulau Tembang. Getting there honestly, though, means the north coast of Manggarai and Manggarai Timur has to be scouted before anything else on this course -- hence scouting priority 1, and the route concept's own open question 1: is there a continuous rideable or walkable corridor Reo to Pota to Riung, and where is the water.",
    "highlight_pois": [
      "p-reo-port",
      "p-north-coast-savanna"
    ],
    "target_km": [
      150,
      200
    ],
    "hab_expected": "medium",
    "scouting_priority": 1,
    "open_questions": [
      "Is there a continuous rideable/walkable corridor Reo→Pota→Riung along or near the north coast, and where is water?",
      "Where does the coastal track die between Pota and Riung, and what replaces it — beach walking, a headland footpath, or a boat portage?",
      "Riung and Pota's coordinates are hand-placed/unverified; both need a field GPS fix."
    ],
    "public": true
  },
  {
    "id": "sec-05-ngada-inerie",
    "order": 5,
    "title": "Ngada: megaliths under Inerie",
    "subtitle": "Cultural checkpoints under a near-perfect volcano",
    "from_node": "n-riung",
    "to_node": "n-aimere",
    "theme": [
      "culture",
      "volcano",
      "highland"
    ],
    "story": "The climb from Riung's coast to the Bajawa plateau (about 1,100 m) is the section's biggest single effort, passing the Mengeruda hot springs near Soa on the way up. Bajawa itself is full resupply -- hotels, market, ATMs -- before the course turns south into megalithic country: Bena (nine clans, paired ngadhu and bhaga ancestor shrines around a stone-terraced square), Luba, Tololela and Gurusina, the last of them rebuilt after a 2018 fire destroyed 27 of its 33 traditional houses. All four sit under Inerie, a near-perfect 2,245 m cone the villages beneath it treat less as scenery than as a presiding relative.\n\nEvery one of these villages is a proposed cultural checkpoint under design rule 5 (villages are hosts, not scenery), and every one needs an agreement with its village council before a single rider passes. The section closes with an honest hike-a-bike option: a steep, loose-soil traverse of Inerie's shoulder down to the arak-distilling coast at Aimere (5-10 km per the route concept's hike-a-bike inventory), with a full circuit of the mountain as an Ultra-variant alternative for those who want more.",
    "highlight_pois": [